{
  "$schema": "../config/knowledge-base/index.schema.json",
  "_comment": "GENERATED FILE — DO NOT HAND-EDIT. Run `yarn knowledge-base:index` to regenerate.",
  "generatedFrom": "scripts/knowledge-base/generate-index.js",
  "tier": 2,
  "topics": [
    {
      "id": "tier2/packages/assets/animations/knowledge-base/animations",
      "tier": 2,
      "path": "packages/assets/animations/knowledge-base/animations.md",
      "title": "Animations",
      "summary": "Guidance for Momentum's animation assets — Lottie/SVG animations, what the library contains, how to consume them via mdc-animation, and how they differ from motion tokens.",
      "canonical": null
    },
    {
      "id": "tier2/packages/assets/brand-visuals/knowledge-base/brand-visuals",
      "tier": 2,
      "path": "packages/assets/brand-visuals/knowledge-base/brand-visuals.md",
      "title": "Brand visuals",
      "summary": "Guidance for Momentum's brand-visuals library — approved logos, wordmarks, and imagery, how to consume them via mdc-brandvisual, and the criteria for inclusion.",
      "canonical": null
    },
    {
      "id": "tier2/packages/assets/fonts/knowledge-base/fonts",
      "tier": 2,
      "path": "packages/assets/fonts/knowledge-base/fonts.md",
      "title": "Fonts",
      "summary": "Install and load the Momentum typeface from @momentum-design/fonts — Inter as a variable font registered under the family name \"Momentum\" — and how it connects to typography tokens.",
      "canonical": null
    },
    {
      "id": "tier2/packages/assets/icons/knowledge-base/icons",
      "tier": 2,
      "path": "packages/assets/icons/knowledge-base/icons.md",
      "title": "Icons",
      "summary": "Guidance for Momentum's Custom Icon Library — icon types, naming, weights, when to use icons versus other assets, and how to consume @momentum-design/icons.",
      "canonical": null
    },
    {
      "id": "tier2/packages/assets/illustrations/knowledge-base/illustrations",
      "tier": 2,
      "path": "packages/assets/illustrations/knowledge-base/illustrations.md",
      "title": "Illustrations",
      "summary": "Guidance for Momentum's illustration library — style principles, when to use, sizing and colour, consumption via mdc-illustration and mdc-illustrationprovider, and accessibility.",
      "canonical": null
    },
    {
      "id": "tier2/packages/assets/tokens/knowledge-base/color",
      "tier": 2,
      "path": "packages/assets/tokens/knowledge-base/color.md",
      "title": "Color",
      "summary": "How Momentum color tokens are structured (usage, prominence, state), how theme and charting colors resolve, and where each semantic color belongs.",
      "canonical": null,
      "websitePath": "foundations/color"
    },
    {
      "id": "tier2/packages/assets/tokens/knowledge-base/dimension",
      "tier": 2,
      "path": "packages/assets/tokens/knowledge-base/dimension.md",
      "title": "Dimension",
      "summary": "Momentum dimension tokens for spacing, border width, corner radius, and fixed size, including the stable and fluid density contracts.",
      "canonical": null
    },
    {
      "id": "tier2/packages/assets/tokens/knowledge-base/elevation",
      "tier": 2,
      "path": "packages/assets/tokens/knowledge-base/elevation.md",
      "title": "Elevation",
      "summary": "The Momentum elevation tokens — a four-step drop-shadow scale that conveys surface depth and layering on the z-axis.",
      "canonical": null,
      "websitePath": "foundations/elevation"
    },
    {
      "id": "tier2/packages/assets/tokens/knowledge-base/glass",
      "tier": 2,
      "path": "packages/assets/tokens/knowledge-base/glass.md",
      "title": "Glass",
      "summary": "The Momentum glass aesthetic and the material, blur, and overlay tokens that build layered, translucent surfaces.",
      "canonical": null,
      "websitePath": "foundations/glass"
    },
    {
      "id": "tier2/packages/assets/tokens/knowledge-base/motion",
      "tier": 2,
      "path": "packages/assets/tokens/knowledge-base/motion.md",
      "title": "Motion",
      "summary": "Momentum motion tokens — the duration, easing, delay, and stagger scales, the named animations built on them, and the principles for applying them.",
      "canonical": null,
      "websitePath": "foundations/motion"
    },
    {
      "id": "tier2/packages/assets/tokens/knowledge-base/theming",
      "tier": 2,
      "path": "packages/assets/tokens/knowledge-base/theming.md",
      "title": "Theming",
      "summary": "How Momentum semantic color tokens resolve across themes and modes, how a theme or charting mode is applied, and how to add one.",
      "canonical": null,
      "websitePath": "foundations/theming"
    },
    {
      "id": "tier2/packages/assets/tokens/knowledge-base/typography",
      "tier": 2,
      "path": "packages/assets/tokens/knowledge-base/typography.md",
      "title": "Typography",
      "summary": "Typography token scale, type styles, and usage guidance for products built with @momentum-design/tokens — body, heading, and headline styles.",
      "canonical": null,
      "websitePath": "foundations/typography"
    },
    {
      "id": "tier2/packages/components/knowledge-base/snowflake-components",
      "tier": 2,
      "path": "packages/components/knowledge-base/snowflake-components.md",
      "title": "Snowflake Components",
      "summary": "When it is acceptable to build a one-off \"snowflake\" component versus reusing a Momentum component or widget.",
      "canonical": null
    }
  ]
}
